codProc,nome
0213010070,EXAME PARASITOLOGICO DIRETO P/ LEISHMANIA CHAGASI (LEISHMANIOSE VISCERAL HUMANA)
0213010054,EXAME PARASITOLOGICO DIRETO P/ LEISHMANIAS (LEISHMANIOSE TEGUMENTAR AMERICANA)
0202050130,EXAME QUALITATIVO DE CALCULOS URINARIOS
0212010018,EXAMES IMUNOHEMATOLOGICOS EM DOADOR DE SANGUE
0212010026,EXAMES PRE-TRANSFUSIONAIS I
0212010034,EXAMES PRE-TRANSFUSIONAIS II
0211050091,EXPLORACAO DIAGNOSTICA PELO VIDEO-ELETROENCEFALOGRAMA COM OU SEM USO DE ELETRODO DE PROFUNDIDADE
0213010089,FAGOTIPAGEM P/ IDENTIFICACAO DA SALMONELA TYPHI (FEBRE TIFOIDE)
0202120031,FENOTIPAGEM DE SISTEMA RH - HR
0212010042,FENOTIPAGEM K, FYA, FYB, JKA, JKB EM GEL
0202100090,FISH EM METÁFASE OU NÚCLEO INTERFÁSICO, POR DOENÇA
0204050057,FISTULOGRAFIA
0210010185,FLEBOGRAFIA DE CAVA INFERIOR E/OU SUPERIOR
0210010177,FLEBOGRAFIA DE MEMBRO
0202100057,FOCALIZAÇÃO ISOELÉTRICA DA TRANSFERRINA
0211060100,FUNDOSCOPIA
0211080020,GASOMETRIA
0211080039,GASOMETRIA (APOS EXERCICIO CICLO-ERGOMETRICO)
0211080047,GASOMETRIA (APOS OXIGENIO A 100 DURANTE A DIFUSAO ALVEOLO-CAPILAR)
0202010732,GASOMETRIA (PH PCO2 PO2 BICARBONATO AS2 (EXCESSO OU DEFICIT BASE )
0202030210,GENOTIPAGEM DE VIRUS DA HEPATITE C
0213010542,GENOTIPAGEM DO HCV
0202031241,GENOTIPAGEM DO HIV
0214010015,GLICEMIA CAPILAR
0211060119,GONIOSCOPIA
0211070190,GUSTOMETRIA
0202020371,HEMATOCRITO
0202080153,HEMOCULTURA
0202020380,HEMOGRAMA COMPLETO
0211040045,HISTEROSCOPIA (DIAGNOSTICA)
0209030011,HISTEROSCOPIA CIRÚRGICA
0204050065,HISTEROSSALPINGOGRAFIA
0213010097,HISTOPATOLOGIA P/ IDENTIFICACAO DA HEPATITE A
0213010100,HISTOPATOLOGIA P/ IDENTIFICACAO DA HEPATITE D
0213010119,HISTOPATOLOGIA P/ IDENTIFICACAO DE DENGUE
0213010127,HISTOPATOLOGIA P/ IDENTIFICACAO DE FEBRE AMARELA
0213010135,HISTOPATOLOGIA P/ IDENTIFICACAO DE HEPATITE B
0213010143,HISTOPATOLOGIA P/ IDENTIFICACAO DE HEPATITE C
0213010178,HISTOQUIMICA P/ IDENTIFICACAO DE HEPATITE C
0213010160,HISTOQUIMICA P/ IDENTIFICACAO DO VIRUS DA HEPATITE A
0202080161,IDENTIFICACAO AUTOMATIZADA DE MICROORGANISMOS
0202100103,IDENTIFICAÇÃO DE ALTERAÇÃO CROMOSSÔNICA SUBMICROSCÓPICA POR ARRAY-CGH
0202120040,IDENTIFICACAO DE ANTICORPOS SERICOS IRREGULARES C/ PAINEL DE HEMACIAS
0202040046,IDENTIFICACAO DE FRAGMENTOS DE HELMINTOS
0202050076,IDENTIFICAÇÃO DE GLICÍDIOS URINÁRIOS POR CROMATOGRAFIA (CAMADA DELGADA)
0202100120,IDENTIFICAÇÃO DE GLICOSAMINOGLICANOS URINÁRIOS POR CROMATOGRAFIA EM CAMADA DELGADA , ELETROFORESE E DOSAGEM QUANTITATIVA
0202100111,IDENTIFICAÇÂO DE MUTAÇÃO POR SEQUENCIAMENTO POR AMPLICON ATÉ 500 PARES DE BASES
0202100081,IDENTIFICAÇÃO DE MUTAÇÃO/REARRANJOS POR PCR, PCR SENSÍVEL A METILAÇÃO, qPCR E qPCR SENSÍVEL A METILAÇÃO
0202100138,IDENTIFICAÇÃO DE OLIGOSSACARÍDEOS E SIALOSSACARÍDEOS POR CROMATOGRAFIA (CAMADA DELGADA)
0213010186,IDENTIFICACAO DE VIRUS DA RAIVA POR RT-PCR
0213010194,IDENTIFICACAO DO HANTAVIRUS POR RT-PCR (HANTAVIROSE)
0213010208,IDENTIFICACAO DO VIRUS DA HEPATITE B POR PCR (QUANTITATIVO)
0211070203,IMITANCIOMETRIA
0208020128,IMUNO-CINTILOGRAFIA (ANTICORPO MONOCLONAL)
0213010216,IMUNOCROMATOGRAFIA P/ IDENTIFICACAO DE PLASMODIOS (MALARIA)
0202030229,IMUNOELETROFORESE DE PROTEINAS
0202030237,IMUNOFENOTIPAGEM DE HEMOPATIAS MALIGNAS (POR MARCADOR)
0213010224,IMUNOFLUORESCENCIA DIRETA P/ IDENTIFICACAO DO VIRUS DA INFLUENZA
0213010232,IMUNOFLUORESCENCIA DIRETA P/ IDENTIFICACAO DO VIRUS DA RAIVA
0213010240,IMUNOFLUORESCENCIA INDIRETA P/ (IDENTIFICACAO DE LEPTOSPIRAS (LEPTOSPIROSE)
0213010259,IMUNOFLUORESCENCIA INDIRETA P/ IDENTIFICACAO DA RICKETTSIA RICKTTSII (FEBRE MACULOSA)
0213010267,IMUNOFLUORESCENCIA INDIRETA P/ IDENTIFICACAO DE PLASMODIOS (MALARIA)
0213010275,IMUNOFLUORESCENCIA INDIRETA P/ IDENTIFICACAO DO SHISTOSSOMA MANSONI
0203020049,IMUNOHISTOQUIMICA DE NEOPLASIAS MALIGNAS (POR MARCADOR)
0213010291,IMUNOHISTOQUIMICA P/ IDENTIFICACAO DA RICKETTISIA RICKETTSII (FEBRE MACULOSA)
0213010305,IMUNOHISTOQUIMICA P/ IDENTIFICACAO DE LEPTOSPIRAS (LEPTOSPIROSE)
0213010321,IMUNOHISTOQUIMICA P/ IDENTIFICACAO DO HANTAVIRUS (HANTAVIROSE)
0213010330,IMUNOHISTOQUIMICA P/ IDENTIFICACAO DO VIRUS DA DENGUE
0213010348,IMUNOHISTOQUIMICA P/ IDENTIFICACAO DO VIRUS DA FEBRE AMARELA
0213010356,IMUNOHISTOQUIMICA P/ IDENTIFICACAO DO VIRUS DA HEPATITE B
0213010364,IMUNOHISTOQUIMICA P/ IDENTIFICACAO DO VIRUS DA HEPATITE D
0202030245,INTRADERMORREACAO COM DERIVADO PROTEICO PURIFICADO (PPD)
0211010022,INVESTIGACAO ULTRASSONICA (PLETISMOGRAFIA)
0212020030,IRRADIACAO DE SANGUE E COMPONENTES DESTINADOS A TRANSFUSAO
0213010372,ISOLAMENTO DA RICKETTSIA RICKTTSII (FEBRE MACULOSA)
0213010380,ISOLAMENTO DO VIRUS DA DENGUE
0213010399,ISOLAMENTO DO VIRUS DA FEBRE DO NILO OCIDENTAL
0213010402,ISOLAMENTO DO VIRUS DA INFLUENZA
0213010410,ISOLAMENTO DO VIRUS DA MENINGITE VIRAL
0213010429,ISOLAMENTO DO VIRUS DA POLIOMIELITE
0213010437,ISOLAMENTO DO VIRUS DA RAIVA
0213010445,ISOLAMENTO DO VIRUS DO SARAMPO
0209010045,LAPAROSCOPIA
0209040025,LARINGOSCOPIA
0202020398,LEUCOGRAMA
0210010193,LINFANGIOADENOGRAFIA
0208080040,LINFOCINTILOGRAFIA
0211070211,LOGOAUDIOMETRIA (LDV-IRF-LRF)
0204030030,MAMOGRAFIA
0204030188,MAMOGRAFIA BILATERAL PARA RASTREAMENTO
0211060127,MAPEAMENTO DE RETINA
0211070386,MAPEAMENTO E BALANCEAMENTO DOS ELETRODOS
0205020194,MARCACAO DE LESAO PRE-CIRURGICA DE LESAO NAO PALPAVEL DE MAMA ASSOCIADA A ULTRASSONOGRAFIA
0204030048,MARCACAO PRE-CIRURGICA DE LESAO NAO PALPAVEL DE MAMA ASSOCIADA A MAMOGRAFIA
0211060135,MEDIDA DE OFUSCAMENTO E CONTRASTE
0213010453,MICRO-AGLUTINACAO P/ IDENTIFICACAO DE LEPTOSPIRAS (LEPTOSPIROSE)
0211060143,MICROSCOPIA ESPECULAR DE CORNEA
0204020018,MIELOGRAFIA
0202090191,MIELOGRAMA
0211020044,MONITORAMENTO PELO SISTEMA HOLTER 24 HS (3 CANAIS)
0211020052,MONITORIZACAO AMBULATORIAL DE PRESSAO ARTERIAL (M.A.P.A)
0203020057,NECROPSIA
0211070220,OLFATOMETRIA
0211010030,OSCILOMETRIA DE IMPULSO
0211020079,OXIMETRIA DE PULSO (TESTE DO CORAÇÃOZINHO)
0205020020,PAQUIMETRIA ULTRASSÔNICA
0202080170,PEQUISA DE PNEUMOCYSTI CARINI
0211090069,PERFIL DE PRESSAO URETRAL
0211040053,PERSUFLACAO TUBARIA (DIAGNOSTICA)
0202050149,PESQUISA / DOSAGEM DE AMINOACIDOS (POR CROMATOGRAFIA)
0202050157,PESQUISA DE ALCAPTONA NA URINA
0202050165,PESQUISA DE AMINOACIDOS NA URINA
0202030253,PESQUISA DE ANTICORPO IGG ANTICARDIOLIPINA
0202030261,PESQUISA DE ANTICORPO IGM ANTICARDIOLIPINA
0202030377,PESQUISA DE ANTICORPOS ANTIADENOVIRUS
0202030385,PESQUISA DE ANTICORPOS ANTIAMEBAS
0202030393,PESQUISA DE ANTICORPOS ANTIASPERGILLUS
0202030407,PESQUISA DE ANTICORPOS ANTIBRUCELAS
0202030415,PESQUISA DE ANTICORPOS ANTICISTICERCO
0202030423,PESQUISA DE ANTICORPOS ANTICLAMIDIA (POR IMUNOFLUORESCENCIA)
0202031268,PESQUISA DE ANTICORPOS ANTICORPOS ANTI-HTLV-1 (WESTERN-BLOT)
0202030431,PESQUISA DE ANTICORPOS ANTICORTEX SUPRARENAL
0202030270,PESQUISA DE ANTICORPOS ANTI-DNA
0202030440,PESQUISA DE ANTICORPOS ANTIEQUINOCOCOS
0202030458,PESQUISA DE ANTICORPOS ANTIESCLERODERMA (SCL 70)
0202030466,PESQUISA DE ANTICORPOS ANTIESPERMATOZOIDES
0202090213,PESQUISA DE ANTICORPOS ANTIESPERMATOZOIDES ( ELISA )
0202030474,PESQUISA DE ANTICORPOS ANTIESTREPTOLISINA O (ASLO)
0202030482,PESQUISA DE ANTICORPOS ANTIFIGADO
0202030504,PESQUISA DE ANTICORPOS ANTIGLOMERULO
0202030288,PESQUISA DE ANTICORPOS ANTI-HELICOBACTER PYLORI
0202030296,PESQUISA DE ANTICORPOS ANTI-HIV-1 (WESTERN BLOT)
0202030300,PESQUISA DE ANTICORPOS ANTI-HIV-1 + HIV-2 (ELISA)
0202030318,PESQUISA DE ANTICORPOS ANTI-HTLV-1 + HTLV-2
0202030512,PESQUISA DE ANTICORPOS ANTIILHOTA DE LANGERHANS
0202030520,PESQUISA DE ANTICORPOS ANTIINSULINA
0202030539,PESQUISA DE ANTICORPOS ANTILEPTOSPIRAS
0202030547,PESQUISA DE ANTICORPOS ANTILISTERIA
0202030555,PESQUISA DE ANTICORPOS ANTIMICROSSOMAS
0202030563,PESQUISA DE ANTICORPOS ANTIMITOCONDRIA
0202030571,PESQUISA DE ANTICORPOS ANTIMUSCULO ESTRIADO
0202030580,PESQUISA DE ANTICORPOS ANTIMUSCULO LISO
0202030598,PESQUISA DE ANTICORPOS ANTINUCLEO
0202030601,PESQUISA DE ANTICORPOS ANTIPARIETAIS
0202030610,PESQUISA DE ANTICORPOS ANTIPLASMODIOS
0202030326,PESQUISA DE ANTICORPOS ANTI-RIBONUCLEOPROTEINA (RNP)
0202030334,PESQUISA DE ANTICORPOS ANTI-SCHISTOSOMAS
0202030342,PESQUISA DE ANTICORPOS ANTI-SM
0202030350,PESQUISA DE ANTICORPOS ANTI-SS-A (RO)
0202030369,PESQUISA DE ANTICORPOS ANTI-SS-B (LA)
0202030628,PESQUISA DE ANTICORPOS ANTITIREOGLOBULINA
0202030636,PESQUISA DE ANTICORPOS CONTRA ANTIGENO DE SUPERFICIE DO VIRUS DA HEPATITE B (ANTI-HBS)
0202030644,PESQUISA DE ANTICORPOS CONTRA ANTIGENO E DO VIRUS DA HEPATITE B (ANTI-HBE)
0202030652,PESQUISA DE ANTICORPOS CONTRA HISTOPLASMA
0202030660,PESQUISA DE ANTICORPOS CONTRA O SPOROTRIX SCHENKII
0202030679,PESQUISA DE ANTICORPOS CONTRA O VIRUS DA HEPATITE C (ANTI-HCV)
0202030687,PESQUISA DE ANTICORPOS CONTRA O VIRUS DA HEPATITE D (ANTI-HDV)
0202030695,PESQUISA DE ANTICORPOS CONTRA O VIRUS DO SARAMPO
0202030709,PESQUISA DE ANTICORPOS CONTRA PARACOCCIDIOIDES BRASILIENSIS
0202030717,PESQUISA DE ANTICORPOS E/OU ANTIGENO DO VIRUS SINCICIAL RESPIRATORIO
0202030725,PESQUISA DE ANTICORPOS EIE ANTICLAMIDIA
0202030733,PESQUISA DE ANTICORPOS HETEROFILOS CONTA O VIRUS EPSTEIN-BARR
0202030741,PESQUISA DE ANTICORPOS IGG ANTICITOMEGALOVIRUS
0202030750,PESQUISA DE ANTICORPOS IGG ANTILEISHMANIAS
0202030768,PESQUISA DE ANTICORPOS IGG ANTITOXOPLASMA
0202030776,PESQUISA DE ANTICORPOS IGG ANTITRYPANOSOMA CRUZI
0202030792,PESQUISA DE ANTICORPOS IGG CONTRA ARBOVIRUS
0202030806,PESQUISA DE ANTICORPOS IGG CONTRA O VIRUS DA HEPATITE A (HAV-IGG)
0202030814,PESQUISA DE ANTICORPOS IGG CONTRA O VIRUS DA RUBEOLA
0202030822,PESQUISA DE ANTICORPOS IGG CONTRA O VIRUS DA VARICELA-HERPES ZOSTER
0202030830,PESQUISA DE ANTICORPOS IGG CONTRA O VIRUS EPSTEIN-BARR
0202030849,PESQUISA DE ANTICORPOS IGG CONTRA O VIRUS HERPES SIMPLES
0202030784,PESQUISA DE ANTICORPOS IGG E IGM CONTRA ANTIGENO CENTRAL DO VIRUS DA HEPATITE B (ANTI-HBC-TOTAL)
0202030857,PESQUISA DE ANTICORPOS IGM ANTICITOMEGALOVIRUS
0202030865,PESQUISA DE ANTICORPOS IGM ANTILEISHMANIAS
0202030873,PESQUISA DE ANTICORPOS IGM ANTITOXOPLASMA
0202030881,PESQUISA DE ANTICORPOS IGM ANTITRYPANOSOMA CRUZI
0202030890,PESQUISA DE ANTICORPOS IGM CONTRA ANTIGENO CENTRAL DO VIRUS DA HEPATITE B (ANTI-HBC-IGM)
0202030903,PESQUISA DE ANTICORPOS IGM CONTRA ARBOVIRUS
0202030911,PESQUISA DE ANTICORPOS IGM CONTRA O VIRUS DA HEPATITE A (HAV-IGG)
0202030920,PESQUISA DE ANTICORPOS IGM CONTRA O VIRUS DA RUBEOLA
0202030938,PESQUISA DE ANTICORPOS IGM CONTRA O VIRUS DA VARICELA-HERPES ZOSTER
0202030946,PESQUISA DE ANTICORPOS IGM CONTRA O VIRUS EPSTEIN-BARR
0202030954,PESQUISA DE ANTICORPOS IGM CONTRA O VIRUS HERPES SIMPLES
0202120058,PESQUISA DE ANTICORPOS IRREGULARES PELO METODO DA ELUICAO
0202120066,PESQUISA DE ANTICORPOS SERICOS IRREGULARES 37OC
0202120074,PESQUISA DE ANTICORPOS SERICOS IRREGULARES A FRIO
0202030962,PESQUISA DE ANTIGENO CARCINOEMBRIONARIO (CEA)
0202030970,PESQUISA DE ANTIGENO DE SUPERFICIE DO VIRUS DA HEPATITE B (HBSAG)
0202030989,PESQUISA DE ANTIGENO E DO VIRUS DA HEPATITE B (HBEAG)
0202020401,PESQUISA DE ATIVIDADE DO COFATOR DE RISTOCETINA
0202080188,PESQUISA DE BACILO DIFTERICO
0202050173,PESQUISA DE BETA-MERCAPTO-LACTATO-DISSULFIDURIA
0202050181,PESQUISA DE CADEIAS LEVES KAPPA E LAMBDA
0202090230,PESQUISA DE CARACTERES FISICOS NO LIQUOR
0202020410,PESQUISA DE CELULAS LE
0202090248,PESQUISA DE CELULAS ORANGIOFILAS
0202050190,PESQUISA DE CISTINA NA URINA
0202050203,PESQUISA DE COPROPORFIRINA NA URINA
0214010023,PESQUISA DE CORPOS CETONICOS NA URINA
0202020428,PESQUISA DE CORPUSCULOS DE HEINZ
0202031004,PESQUISA DE CRIOGLOBULINAS
0202090256,PESQUISA DE CRISTAIS C/ LUZ POLARIZADA
0202040054,PESQUISA DE ENTEROBIUS VERMICULARES (OXIURUS OXIURA)
0202040062,PESQUISA DE EOSINOFILOS
0202050211,PESQUISA DE ERROS INATOS DO METABOLISMO NA URINA
0202090264,PESQUISA DE ESPERMATOZOIDES (APOS VASECTOMIA)
0202080196,PESQUISA DE ESTREPTOCOCOS BETA-HEMOLITICOS DO GRUPO A
0202031012,PESQUISA DE FATOR REUMATOIDE (WAALER-ROSE)
0202120082,PESQUISA DE FATOR RH (INCLUI D FRACO)
0202050220,PESQUISA DE FENIL-CETONA NA URINA
0202020436,PESQUISA DE FILARIA
0211070238,PESQUISA DE FISTULA PERILINFATICA
0202050238,PESQUISA DE FRUTOSE NA URINA
0202050246,PESQUISA DE GALACTOSE NA URINA
0211070246,PESQUISA DE GANHO DE INSERCAO
0214010031,PESQUISA DE GLICOSE NA URINA
0202050254,PESQUISA DE GONADOTROFINA CORIONICA
0202040070,PESQUISA DE GORDURA FECAL
0202080200,PESQUISA DE HAEMOPHILUS DUCREY
0202080218,PESQUISA DE HELICOBACTER PYLORI
0202020444,PESQUISA DE HEMOGLOBINA S
0202031020,PESQUISA DE HIV-1 POR IMUNOFLUORESCENCIA
0202050262,PESQUISA DE HOMOCISTINA NA URINA
0202031039,PESQUISA DE IMUNOGLOBULINA E (IGE) ALERGENO-ESPECIFICA
0202050270,PESQUISA DE LACTOSE NA URINA
0202040089,PESQUISA DE LARVAS NAS FEZES
0202080226,PESQUISA DE LEPTOSPIRAS
0202040097,PESQUISA DE LEUCOCITOS NAS FEZES
0202040100,PESQUISA DE LEVEDURAS NAS FEZES
0202060470,PESQUISA DE MACROPROLACTINA
0202050289,PESQUISA DE MUCOPOLISSACARIDEOS NA URINA
0202040119,PESQUISA DE OVOS DE SCHISTOSOMAS (EM FRAGMENTO DE MUCOSA)
0202040127,PESQUISA DE OVOS E CISTOS DE PARASITAS
0211070254,PESQUISA DE PARES CRANIANOS
0202020452,PESQUISA DE PLASMODIO
0202050297,PESQUISA DE PORFOBILINOGENIO NA URINA
0202050300,PESQUISA DE PROTEINAS URINARIAS (POR ELETROFORESE)
0202090272,PESQUISA DE RAGOCITOS NO LIQUIDO SINOVIAL E DERRAMES
0202040135,PESQUISA DE ROTAVIRUS NAS FEZES
0202040143,PESQUISA DE SANGUE OCULTO NAS FEZES
0202040151,PESQUISA DE SUBSTANCIAS REDUTORAS NAS FEZES
0202050319,PESQUISA DE TIROSINA NA URINA
0202080234,PESQUISA DE TREPONEMA PALLIDUM
0202020460,PESQUISA DE TRIPANOSSOMA
0213010461,PESQUISA DE TRIPANOSSOMAS (NO BARBEIRO)
0202040160,PESQUISA DE TRIPSINA NAS FEZES
0202040178,PESQUISA DE TROFOZOITAS NAS FEZES
0202031047,PESQUISA DE TRYPANOSOMA CRUZI (POR IMUNOFLUORESCENCIA)
0204050073,PIELOGRAFIA ANTEROGRADA PERCUTANEA
0204050081,PIELOGRAFIA ASCENDENTE
0204020026,PLANIGRAFIA DE COLUNA VERTEBRAL
0204010020,PLANIGRAFIA DE LARINGE
0204060044,PLANIGRAFIA DE OSSO - SUBSIDIARIA A OUTROS EXAMES (POR PLANO)
0204060052,PLANIGRAFIA DE OSSO EM 2 PLANOS
0204050090,PLANIGRAFIA DE RIM C/ CONTRASTE
0204050103,PLANIGRAFIA DE RIM S/ CONTRASTE
0211010049,PLETISMOGRAFIA (POR LATERALIDADE / TERRITORIO)
0211050105,POLISSONOGRAFIA
0210010207,PORTOGRAFIA TRANS-HEPATICA
0211060151,POTENCIAL DE ACUIDADE VISUAL
0211050113,POTENCIAL EVOCADO AUDITIVO
0211070262,POTENCIAL EVOCADO AUDITIVO DE CURTA MEDIA E LONGA LATENCIA
0211070270,POTENCIAL EVOCADO AUDITIVO P/ TRIAGEM AUDITIVA (TESTE DA ORELHINHA)
0211070394,POTENCIAL EVOCADO ELETRICAMENTE NO SISTEMA AUDITIVO
0211050121,POTENCIAL EVOCADO VISUAL / OCCIPTO
0211050130,POTENCIAL SOSMATO-SENSITIVO
0211060160,POTENCIAL VISUAL EVOCADO
0212020048,PREPARO DE COMPONENTES ALIQUOTADOS
0212020056,PREPARO DE COMPONENTES LAVADOS
0212020064,PROCESSAMENTO DE SANGUE
0213010470,PROVA BIOLOGICA P/ IDENTIFICACAO DO VIRUS DA RAIVA
0202080242,PROVA CONFIRMATÓRIA DA PRESENÇA DE MICRO-ORGANISMOS COLIFORMES
0213010488,PROVA CONTRA-IMUNOELETROFORESE P/ MENINGOCOCOS (MENINGITE BACTERIANA)
0202010740,PROVA DA D-XILOSE
0202020479,PROVA DE COMPATIBILIDADE PRE-TRANSFUSIONAL (MEIOS SALINOS, ALBUMINOSO E COOMBS)
0202020487,PROVA DE CONSUMO DE PROTROMBINA
0202050327,PROVA DE DILUICAO (URINA)
0211080063,PROVA DE FUNCAO PULMONAR SIMPLES
0211070289,PROVA DE FUNCAO TUBARIA
0202090280,PROVA DE PROGRESSAO ESPERMATICA (CADA)
0202020495,PROVA DE RETRACAO DO COAGULO
0213010496,PROVA DE TOXIGENICIDADE P/ BACILO DIFTERICO (IN VITRO)
0202020509,PROVA DO LACO
0202090299,PROVA DO LATEX P/ HAEMOPHILLUS INFLUENZAE, STREPTOCOCCUS PNEUMONIAE, NEISSERIA MENINGITIDIS (SOROTIPOS A, B, C)
0202090302,PROVA DO LATEX P/ PESQUISA DO FATOR REUMATOIDE
0211080071,PROVA FARMACODINAMICA
0202031055,PROVAS DE PRAUSNITZ-KUSTNER (PK)
0202031063,PROVAS IMUNO-ALERGICAS BACTERIANAS
0201010585,PUNCAO ASPIRATIVA DE MAMA POR AGULHA FINA
0201010593,PUNCAO DE CISTERNA SUB-OCCIPITAL
0201010607,PUNCAO DE MAMA POR AGULHA GROSSA
0201010615,PUNCAO DE VAGINA
0201010623,PUNCAO EXPLORADORA DO DEFERENTE
0201010631,PUNCAO LOMBAR
0201010640,PUNCAO P/ ESVAZIAMENTO
0201010658,PUNCAO VENTRICULAR TRANSFONTANELA
0213010500,QUANTIFICACAO DA CARGA VIRAL DO HIV (RNA)
0202031071,QUANTIFICACAO DE RNA DO HIV-1
0202031080,QUANTIFICACAO DE RNA DO VIRUS DA HEPATITE C
0202100049,QUANTIFICAÇÃO/AMPLIFICAÇÃO DO HER-2
0204010039,RADIOGRAFIA BILATERAL DE ORBITAS (PA + OBLIQUAS + HIRTZ)
0204050111,RADIOGRAFIA DE ABDOMEN (AP + LATERAL / LOCALIZADA)
0204050120,RADIOGRAFIA DE ABDOMEN AGUDO (MINIMO DE 3 INCIDENCIAS)
0204050138,RADIOGRAFIA DE ABDOMEN SIMPLES (AP)
0204040019,RADIOGRAFIA DE ANTEBRACO
0204010047,RADIOGRAFIA DE ARCADA ZIGOMATICO-MALAR (AP+ OBLIQUAS)
0204040027,RADIOGRAFIA DE ARTICULACAO ACROMIO-CLAVICULAR
0204060060,RADIOGRAFIA DE ARTICULACAO COXO-FEMORAL
0204040035,RADIOGRAFIA DE ARTICULACAO ESCAPULO-UMERAL
0204040043,RADIOGRAFIA DE ARTICULACAO ESTERNO-CLAVICULAR
0204060079,RADIOGRAFIA DE ARTICULACAO SACRO-ILIACA
0204010055,RADIOGRAFIA DE ARTICULACAO TEMPORO-MANDIBULAR BILATERAL
0204060087,RADIOGRAFIA DE ARTICULACAO TIBIO-TARSICA
0204060095,RADIOGRAFIA DE BACIA
0204040051,RADIOGRAFIA DE BRACO
0204060109,RADIOGRAFIA DE CALCANEO
0204010063,RADIOGRAFIA DE CAVUM (LATERAL + HIRTZ)
0204040060,RADIOGRAFIA DE CLAVICULA
0204020042,RADIOGRAFIA DE COLUNA CERVICAL (AP + LATERAL + TO / FLEXAO)
0204020034,RADIOGRAFIA DE COLUNA CERVICAL (AP + LATERAL + TO + OBLIQUAS)
0204020050,RADIOGRAFIA DE COLUNA CERVICAL FUNCIONAL / DINAMICA
0204020069,RADIOGRAFIA DE COLUNA LOMBO-SACRA
0204020077,RADIOGRAFIA DE COLUNA LOMBO-SACRA (C/ OBLIQUAS)
0204020085,RADIOGRAFIA DE COLUNA LOMBO-SACRA FUNCIONAL / DINAMICA
0204020093,RADIOGRAFIA DE COLUNA TORACICA (AP + LATERAL)
0204020107,RADIOGRAFIA DE COLUNA TORACO-LOMBAR
0204020115,RADIOGRAFIA DE COLUNA TORACO-LOMBAR DINAMICA
0204030056,RADIOGRAFIA DE CORACAO E VASOS DA BASE (PA + LATERAL + OBLIQUA)
0204030064,RADIOGRAFIA DE CORACAO E VASOS DA BASE (PA + LATERAL)
0204030072,RADIOGRAFIA DE COSTELAS (POR HEMITORAX)
0204040078,RADIOGRAFIA DE COTOVELO
0204060117,RADIOGRAFIA DE COXA
0204010071,RADIOGRAFIA DE CRANIO (PA + LATERAL + OBLIGUA / BRETTON + HIRTZ)
0204010080,RADIOGRAFIA DE CRANIO (PA + LATERAL)
0204040086,RADIOGRAFIA DE DEDOS DA MAO
0204040116,RADIOGRAFIA DE ESCAPULA/OMBRO (TRES POSICOES)
0204030080,RADIOGRAFIA DE ESOFAGO
0204030099,RADIOGRAFIA DE ESTERNO
0204050146,RADIOGRAFIA DE ESTOMAGO E DUODENO
0204050154,RADIOGRAFIA DE INTESTINO DELGADO (TRANSITO)
0204060125,RADIOGRAFIA DE JOELHO (AP + LATERAL)
0204060133,RADIOGRAFIA DE JOELHO OU PATELA (AP + LATERAL + AXIAL)
0204060141,RADIOGRAFIA DE JOELHO OU PATELA (AP + LATERAL + OBLIQUA + 3 AXIAIS)
0204010098,RADIOGRAFIA DE LARINGE
0204040094,RADIOGRAFIA DE MAO
0204040108,RADIOGRAFIA DE MAO E PUNHO (P/ DETERMINACAO DE IDADE OSSEA)
0204010101,RADIOGRAFIA DE MASTOIDE / ROCHEDOS (BILATERAL)
0204010110,RADIOGRAFIA DE MAXILAR (PA + OBLIQUA)
0204030102,RADIOGRAFIA DE MEDIASTINO (PA E PERFIL)
0204010128,RADIOGRAFIA DE OSSOS DA FACE (MN + LATERAL + HIRTZ)
0204060150,RADIOGRAFIA DE PE / DEDOS DO PE
0204060168,RADIOGRAFIA DE PERNA
0204030110,RADIOGRAFIA DE PNEUMOMEDIASTINO
0204040124,RADIOGRAFIA DE PUNHO (AP + LATERAL + OBLIQUA)
0204010136,RADIOGRAFIA DE REGIAO ORBITARIA (LOCALIZACAO DE CORPO ESTRANHO)
0204020123,RADIOGRAFIA DE REGIAO SACRO-COCCIGEA
0204010144,RADIOGRAFIA DE SEIOS DA FACE (FN + MN + LATERAL + HIRTZ)
0204010152,RADIOGRAFIA DE SELA TURSICA (PA + LATERAL + BRETTON)
0204030129,RADIOGRAFIA DE TORAX (APICO-LORDORTICA)
0204030137,RADIOGRAFIA DE TÓRAX (PA + INSPIRAÇÃO + EXPIRAÇÃO + LATERAL)
0204030145,RADIOGRAFIA DE TORAX (PA + LATERAL + OBLIQUA)
0204030153,RADIOGRAFIA DE TORAX (PA E PERFIL)
0204030161,RADIOGRAFIA DE TORAX (PA PADRAO OIT)
0204030170,RADIOGRAFIA DE TORAX (PA)
0204010160,RADIOGRAFIA OCLUSAL
0204050162,RADIOGRAFIA P/ ESTUDO DO DELGADO C/ DUPLO CONTRASTE (ENTEROCLISE)
0204010179,RADIOGRAFIA PANORAMICA
0204020131,RADIOGRAFIA PANORAMICA DE COLUNA TOTAL- TELESPONDILOGRAFIA ( P/ ESCOLIOSE)
0204060176,RADIOGRAFIA PANORAMICA DE MEMBROS INFERIORES
0204010187,RADIOGRAFIA PERI-APICAL INTERPROXIMAL (BITE-WING)
0202020517,RASTREIO P/ DEFICIENCIA DE ENZIMAS ERITROCITARIAS
0202031101,REACAO DE MONTENEGRO ID
0202090310,REACAO DE PANDY
0202090329,REACAO DE RIVALTA NO LIQUIDO SINOVIAL E DERRAMES
0211070297,REAVALIACAO DIAGNOSTICA DE DEFICIENCIA AUDITIVA EM PACIENTE MAIOR DE 3 ANOS
0211070300,REAVALIACAO DIAGNOSTICA DE DEFICIENCIA AUDITIVA EM PACIENTE MENOR DE 3 ANOS
0211070408,REFLEXO ESTAPEDIANO ELICIADO ELETRICAMENTE
0207030014,RESSONANCIA MAGNETICA DE ABDOMEN SUPERIOR
0207010021,RESSONANCIA MAGNETICA DE ARTICULACAO TEMPORO-MANDIBULAR (BILATERAL)
0207030022,RESSONANCIA MAGNETICA DE BACIA / PELVE / ABDOMEN INFERIOR
0207010030,RESSONANCIA MAGNETICA DE COLUNA CERVICAL/PESCOÇO
0207010048,RESSONANCIA MAGNETICA DE COLUNA LOMBO-SACRA
0207010056,RESSONANCIA MAGNETICA DE COLUNA TORACICA
0207020019,RESSONANCIA MAGNETICA DE CORACAO / AORTA C/ CINE
0207010064,RESSONANCIA MAGNETICA DE CRANIO
0207030030,RESSONANCIA MAGNETICA DE MEMBRO INFERIOR (UNILATERAL)
0207020027,RESSONANCIA MAGNETICA DE MEMBRO SUPERIOR (UNILATERAL)
0207010072,RESSONANCIA MAGNETICA DE SELA TURCICA
0207020035,RESSONANCIA MAGNETICA DE TORAX
0207030049,RESSONANCIA MAGNETICA DE VIAS BILIARES/COLANGIORRESSONANCIA
0211060178,RETINOGRAFIA COLORIDA BINOCULAR
0211060186,RETINOGRAFIA FLUORESCENTE BINOCULAR
0209010053,RETOSSIGMOIDOSCOPIA
0211070319,SELECAO E VERIFICACAO DE BENEFICIO DO AASI
0213010518,SEQUENCIAMENTO P/ IDENTIFICACAO DO VIRUS DA MENINGITE VIRAL
0213010526,SEQUENCIAMENTO P/ IDENTIFICACAO DO VIRUS DA POLIOMIELITE
0213010534,SEQUENCIAMENTO P/ IDENTIFICACAO DO VIRUS DO SARAMPO
0204010195,SIALOGRAFIA (POR GLANDULA)
0212010050,SOROLOGIA DE DOADOR DE SANGUE
0213010550,SOROLOGIA P/ IDENTIFICACAO DO VIBRIO CHOLERAE
0204010209,TELERADIOGRAFIA COM TRACADOS E SEM TRACADOS
0211080080,TESTE DA CAMINHADA DE 6 MINUTOS
0202020525,TESTE DE AGREGACAO DE PLAQUETAS
0202090337,TESTE DE CLEMENTS
0213010569,TESTE DE ELISA IGG P/ IDENTIFICACAO DE PARVOVIRUS (PARVOVIROSE)
0213010577,TESTE DE ELISA IGG P/ IDENTIFICACAO DO TOXOPLASMA GONDII (TOXOPLASMOSE)
0213010585,TESTE DE ELISA IGG P/ IDENTIFICACAO DO VIRUS DO SARAMPO
0213010607,TESTE DE ELISA IGM P/ IDENTIFICACAO DO PARVOVIRUS (PARVOVIROSE)
0213010615,TESTE DE ELISA IGM P/ IDENTIFICACAO DO VIRUS DO SARAMPO
0213010623,TESTE DE ELISA P/ IDENTIFICACAO DO VIRUS DA FEBRE AMARELA (ENSAIO IMUNOENZIMATICO)
0211020060,TESTE DE ESFORCO / TESTE ERGOMETRICO
0202060420,TESTE DE ESTIMULO COM GNRH OU COM AGONISTA GNRH
0202060403,TESTE DE ESTIMULO DA PROLACTINA / TSH APOS TRH
0202060411,TESTE DE ESTIMULO DA PROLACTINA APOS CLORPROMAZINA
0202060438,TESTE DE ESTIMULO DO HGH APOS GLUCAGON
0202090345,TESTE DE GASTROACIDOGRAMA - SECRECAO BASAL POR 60 EM 4 AMOSTRAS
0202020533,TESTE DE HAM (HEMOLISE ACIDA)
0213010631,TESTE DE HEMAGLUTINACAO INDIRETA P/ IDENTIFICACAO DO VIRUS DA INFLUENZA
0213010640,TESTE DE HEMAGLUTINACAO P/ IDENTIFICACAO DA PASTEURELLA PESTIS (PESTE BUBONICA)
0213010658,TESTE DE HEMAGLUTINACAO P/ IDENTIFICACAO DO VIRUS DA FEBRE AMARELA
0213010666,TESTE DE HEMAGLUTINACAO P/ IDENTIFICACAO DO VIRUS DA FEBRE DO NILO OCIDENTAL
0213010674,TESTE DE HIBRIDIZACAO IN SITU P/ IDENTIFICACAO DO VIRUS DA DENGUE
0202090353,TESTE DE HOLLANDER NO SUCO GASTRICO
0213010682,TESTE DE NEUTRALIZACAO P/ IDENTIFICACAO DO VIRUS DA FEBRE AMARELA
0211060208,TESTE DE PROVOCACAO DE GLAUCOMA
0211060216,TESTE DE SCHIRMER
0213010690,TESTE DE SENSIBILIDADE A DROGAS CONTRA A TUBERCULOSE
0213010704,TESTE DE SORONEUTRALIZACAO P/ IDENTIFICACAO DO VIRUS DA RAIVA
0202060446,TESTE DE SUPRESSAO DO CORTISOL APOS DEXAMETASONA
0202060454,TESTE DE SUPRESSAO DO HGH APOS GLICOSE
0202010759,TESTE DE TOLERANCIA A INSULINA / HIPOGLICEMIANTES ORAIS
0211060224,TESTE DE VISÃO DE CORES
0211050148,TESTE DE WADA
0202020541,TESTE DIRETO DE ANTIGLOBULINA HUMANA (TAD)
0212010069,TESTE DO ÁCIDO NUCLEICO (NAT) EM AMOSTRAS DE SANGUE DO DOADOR DE SANGUE.
0208030050,TESTE DO PERCLORATO C/ RADIOISOTOPO
0202031128,TESTE FTA-ABS IGG P/ DIAGNOSTICO DA SIFILIS
0202031136,TESTE FTA-ABS IGM P/ DIAGNOSTICO DA SIFILIS
0202120090,TESTE INDIRETO DE ANTIGLOBULINA HUMANA (TIA)
0202090361,TESTE MOLECULAR PARA A DETECÇÃO DO COMPLEXO MYCOBACTERIUM TUBERCULOSIS
0202031110,TESTE NÃO TREPONEMICO P/ DETECÇÃO DE SIFILIS
0202031179,TESTE NÃO TREPONEMICO P/ DETECÇÃO DE SIFILIS EM GESTANTES
0211060232,TESTE ORTÓPTICO
0211060240,TESTE P/ ADAPTACAO DE LENTE DE CONTATO
0202060462,TESTE P/ INVESTIGACAO DO DIABETES INSIPIDUS
0214010066,TESTE RÁPIDO DE GRAVIDEZ
0214010120,TESTE RÁPIDO PARA DENGUE IGG/IGM
0214010090,TESTE RÁPIDO PARA DETECÇÃO DE HEPATITE C
0214010040,TESTE RAPIDO PARA DETECCAO DE HIV NA GESTANTE OU PAI/PARCEIRO
0214010104,TESTE RÁPIDO PARA DETECÇÃO DE INFECÇÃO PELO HBV
0214010058,TESTE RÁPIDO PARA DETECÇÃO DE INFECÇÃO PELO HIV
0214010139,TESTE RÁPIDO PARA FEBRE CHIKUNGUNYA IGM
0214010074,TESTE RÁPIDO PARA SÍFILIS
0214010082,TESTE RÁPIDO PARA SÍFILIS NA GESTANTE OU PAI/PARCEIRO
0214010112,TESTE RÁPIDO PARA VÍRUS ZIKA IGG/IGM
0202031098,TESTE TREPONEMICO P/ DETECÇÃO DE SIFILIS
0211070327,TESTES ACUMETRICOS (DIAPASAO)
0202031144,TESTES ALERGICOS DE CONTATO
0211070335,TESTES AUDITIVOS SUPRALIMINARES
0202031152,TESTES CUTANEOS DE LEITURA IMEDIATA
0211070343,TESTES DE PROCESSAMENTO AUDITIVO
0211070351,TESTES VESTIBULARES / OTONEUROLOGICOS
0202120104,TITULACAO DE ANTICORPOS ANTI A E/OU ANTI B
0211040061,TOCOCARDIOGRAFIA ANTE-PARTO
0206030010,TOMOGRAFIA COMPUTADORIZADA DE ABDOMEN SUPERIOR
0206030029,TOMOGRAFIA COMPUTADORIZADA DE ARTICULACOES DE MEMBRO INFERIOR
0206020015,TOMOGRAFIA COMPUTADORIZADA DE ARTICULACOES DE MEMBRO SUPERIOR
0206010010,TOMOGRAFIA COMPUTADORIZADA DE COLUNA CERVICAL C/ OU S/ CONTRASTE
0206010028,TOMOGRAFIA COMPUTADORIZADA DE COLUNA LOMBO-SACRA C/ OU S/ CONTRASTE
0206010036,TOMOGRAFIA COMPUTADORIZADA DE COLUNA TORACICA C/ OU S/ CONTRASTE
0206010044,TOMOGRAFIA COMPUTADORIZADA DE FACE / SEIOS DA FACE / ARTICULACOES TEMPORO-MANDIBULARES
0206030037,TOMOGRAFIA COMPUTADORIZADA DE PELVE / BACIA / ABDOMEN INFERIOR
